{
  "$schema": "https://json-schema.org/draft/2020-12/schema",
  "$id": "https://bflabs.dev/schemas/discover-content-input.schema.json",
  "type": "object",
  "required": ["schema_version", "workflow", "discovery", "content"],
  "additionalProperties": false,
  "properties": {
    "schema_version": { "const": "1.0.0" },
    "workflow": { "const": "discover-content" },
    "discovery": { "$ref": "discovery-brief.schema.json" },
    "content": { "$ref": "content-brief.schema.json" }
  }
}
