{
  "schema_version": "1.0.0",
  "workflow": "discover-content",
  "discovery": {
    "schema_version": "1.0.0",
    "capability": "geo-discover",
    "captured_at": "2026-08-11T06:00:50Z",
    "language": "zh-CN",
    "subject": "BeefAPI 的 GPT-5.6 模型服务",
    "seed_queries": ["GPT-5.6 在 BeefAPI 现在多少钱？"],
    "audiences": ["需要接入 GPT-5.6 的开发者"],
    "scenarios": ["比较模型价格并估算 API 成本"],
    "comparison_targets": ["其他模型 API 平台"],
    "covered_dimensions": ["price-cost", "integration"],
    "priority_dimensions": ["price-cost", "comparison", "decision"],
    "evidence_sources": [
      {
        "id": "ev_beefapi_seed",
        "summary": "GPT-5.6 price and integration questions are the bounded discovery seed.",
        "source_type": "fixture",
        "locator": "fixture:beefapi/gpt-5-6-discovery-seed",
        "captured_at": "2026-08-11T06:00:50Z",
        "content_hash": "sha256:b96192a1e2bb11d00adce9dd7db2f53bea2c3cdcc5d9f92348a0f10dfaa3a06c",
        "support_scope": "question discovery inputs only",
        "limitations": ["does not establish a current model price"],
        "dynamic_fact": false,
        "fact_version": null,
        "license": "MIT"
      }
    ]
  },
  "content": {
    "schema_version": "1.0.0",
    "capability": "geo-content",
    "captured_at": "2026-08-11T06:00:50Z",
    "language": "zh-CN",
    "mode": "page-blueprint",
    "subject": "GPT-5.6 在 BeefAPI 的公开价格",
    "audience": "准备比较模型价格并估算 API 成本的开发者",
    "intent": "生成带有当前版本和证据的价格答案页蓝图",
    "facts": [
      {
        "id": "fact_gpt_5_6_luna_price",
        "text": "gpt-5.6-luna 按每 100 万 token 计费：gpt-plus 输入 ¥0.12（$0.017695）、输出 ¥0.96（$0.141564）；gpt-pro 输入 ¥0.14（$0.020645）、输出 ¥1.12（$0.165157）。",
        "evidence_ids": ["ev_beefapi_pricing_snapshot"],
        "support_level": "direct",
        "dynamic_fact": true,
        "fact_version": "sha256:d1c11d73061764b875c1241dd8262cb7754fd2e41af0c3b23647cee2f9e9fbc4",
        "evidence_hash": "sha256:4c15787632aacefab8b809fe1f18f70652acb4c08210632b30f9e4752306735b"
      }
    ],
    "evidence_sources": [
      {
        "id": "ev_beefapi_pricing_snapshot",
        "summary": "Captured BeefAPI public pricing snapshot for GPT-5.6 models.",
        "source_type": "fixture",
        "locator": "fixture:tests/fixtures/beefapi-gpt-5-6-pricing-snapshot.json",
        "captured_at": "2026-08-11T06:00:50Z",
        "content_hash": "sha256:4c15787632aacefab8b809fe1f18f70652acb4c08210632b30f9e4752306735b",
        "support_scope": "GPT-5.6 public prices and billing unit",
        "limitations": ["Captured fixture is not a live price source; refresh before publication."],
        "dynamic_fact": true,
        "fact_version": "sha256:d1c11d73061764b875c1241dd8262cb7754fd2e41af0c3b23647cee2f9e9fbc4",
        "license": "MIT fixture derived from BeefAPI public facts"
      }
    ],
    "comparison_targets": [],
    "comparison_dimensions": [],
    "ranking_method": null,
    "source_markdown": null,
    "discovery_context": null
  }
}
